"name_with_owner","sha","author","date","verified","message","num_issues","commit_month","has_ci"
"birchill/10ten-ja-reader","2f73cbd7a2abd56d247e8736a26da2f86c15f8ca","birtles","2022-01-31 06:47:10","false","feat: support shogi shorthand

And also fix a bug where we treated 生 as promotion instead of
non-promotion.",5,61,1
"birchill/10ten-ja-reader","c46993d08ca7b20057f23305995e61e31cf7b37d","birtles","2022-02-02 08:54:43","false","chore: update changelog",5,61,1
"birchill/10ten-ja-reader","a8ee2e466a629d66559da1710e78b356aea4d086","birtles","2022-02-01 06:22:23","false","feat: render shogi side information",5,61,1
"birchill/10ten-ja-reader","e38b6e56e2611ca11e50ace5a063749515bb62e4","birtles","2022-01-28 03:01:40","false","chore: fix eslint warnings in webpack.config.js",6,61,1
"birchill/10ten-ja-reader","9bcb573eede1e6350e9ed7f206e87e55a83f8564","birtles","2022-01-27 05:50:45","false","chore: use builder utility in clipboard.ts",5,61,1
"birchill/10ten-ja-reader","7a4cc5857cdefe17995607ec52faeca1dcf456e2","birtles","2022-01-26 06:03:05","false","chore: move CopyState to a separate file",5,61,1
"birchill/10ten-ja-reader","1d46ad08292efd0fc8818478249e10f284d9544e","birtles","2022-01-27 06:04:03","false","chore: move builder.ts to utils/",5,61,1
"birchill/10ten-ja-reader","68c599c8f9bc1cf1618e3c6c2659db4ae7c44cc0","birtles","2021-12-07 02:49:37","false","chore: add comment",7,59,1
"birchill/10ten-ja-reader","f17db000ddf67fff20e28ad8fd87563a0be7e5f3","birtles","2022-01-27 06:44:49","false","chore: tidy up rendering of options page and other bits and pieces",5,61,1
"birchill/10ten-ja-reader","a3fcb02514a08045f0a0fa52b366b0d5913ca48b","birtles","2022-01-26 03:21:36","false","chore: tidy up tab bar rendering",6,60,1
"birchill/10ten-ja-reader","d213c4f66a41de98b83dcec83b5d67bc46d23d76","birtles","2022-01-26 03:33:31","false","feat: dim irregular/old/rare kanji headwords when matching on kana

See #877.",6,60,1
"birchill/10ten-ja-reader","c8d9ac9bc0267d3bb458aee3f0f0f787529ce0e7","birtles","2022-01-26 03:23:39","false","chore: update changelog",6,60,1
"birchill/10ten-ja-reader","ed9efe99444478da2209f3ccb5e712ca886ca177","birtles","2022-01-27 06:01:27","false","chore: tidy up popup rendering somewhat",5,61,1
"birchill/10ten-ja-reader","0901496afb8134a4d9ada189c21dac5f92c5a03f","birtles","2021-12-07 01:45:12","false","fix: use proper mime type for copying text data",7,59,1
"birchill/10ten-ja-reader","f898d07960f0a9a5157468feade2b787a37049df","birtles","2022-01-14 09:13:53","false","chore: tidy up a few more icons",5,60,1
"birchill/10ten-ja-reader","2bccef31f3040c5a738bd97540f15682adba8dba","birtles","2022-01-20 03:48:46","false","chore: tidy up name rendering",6,60,1
"birchill/10ten-ja-reader","73b5cf5729a3e6f5189af084f0eea6b635c223f9","birtles","2022-01-20 04:09:09","false","feat: dim irregular and old readings when looking up by kanji

Addresses the second suggestion in
https://github.com/birchill/10ten-ja-reader/issues/877#issue-1104654078",6,60,1
"birchill/10ten-ja-reader","4bb5064392f8e70d6257bbf4547f408e9d00beaa","birtles","2021-12-07 02:46:58","false","fix: making copying work on http sites in Safari",7,59,1
"birchill/10ten-ja-reader","35fddb8fc908fbfcb00d44cdd34669fec66c5934","birtles","2022-01-18 09:08:58","false","chore: tidy up kanji rendering",6,60,1
"birchill/10ten-ja-reader","ab687451cd18ee9939763a0811578a543e5d9919","birtles","2022-01-17 05:44:13","false","feat: show more common kana readings when looking up by irregular readings

This implements the first suggestion from #877.",6,60,1
"birchill/10ten-ja-reader","ae8ea84394b557c626108e560267329348e26269","birtles","2022-01-14 09:37:25","false","chore: tidy up spinner icon",5,60,1
"birchill/10ten-ja-reader","ab508e118a74476fe31f0174fc13b4676c0fa61b","birtles","2022-01-13 09:35:39","false","chore: move namespace declarations to dom-utils.ts",5,60,1
"birchill/10ten-ja-reader","24bca6e20fc745b8487e5f044d34d84030f933b7","birtles","2022-01-12 11:51:10","false","fix: only show ages when the name entry is for a person

See #863.",6,60,1
"birchill/10ten-ja-reader","303af54f09f3a16604016aa64454232449553c30","birtles","2022-01-12 11:35:24","false","fix: don't recognize dates of birth with only a year

Fixes #863",6,60,1
"birchill/10ten-ja-reader","53f8ed30480e9db33cdc1d21b068ae19d8268f9d","birtles","2022-01-13 07:17:03","false","chore: add linting",5,60,1
"birchill/10ten-ja-reader","58a285c78430773560f2aa8d1c85a194c0c5d07d","birtles","2022-01-13 08:46:31","false","chore: update format of changelog",5,60,1
"birchill/10ten-ja-reader","bed7f8a03032b8c70e304516421355a7b2f7c19a","birtles","2022-01-13 11:39:28","false","chore: factor out and tidy up a few SVG icons",5,60,1
"birchill/10ten-ja-reader","0f01915be288e4db94a92f624d9e9536ab4445b3","birtles","2022-01-13 12:08:14","false","chore: tidy up settings and close button rendering",5,60,1
"birchill/10ten-ja-reader","1216d45f6ba338cc910e288430aac909d52c6d1c","birtles","2022-01-13 07:33:11","false","chore: name event variables consistently",5,60,1
"birchill/10ten-ja-reader","277324b5c30948d6c7cb1afecedade736ef0515d","birtles","2021-12-07 01:32:26","false","chore: fix formatting in changelog",7,59,1
"birchill/10ten-ja-reader","d688b616450af921c7cd008dbd4290ae3eab36a6","birtles","2022-01-13 07:27:20","false","chore: update text in playground.html file",5,60,1
"birchill/10ten-ja-reader","059c779dc081f1a429c8c9a351eceaa63fadda37","birtles","2021-12-08 05:58:07","false","fix: ignore touch clicks when the popup is showing",7,59,1
"birchill/10ten-ja-reader","709bd1444c82f8fa3796ddb745f0b81d818a105b","birtles","2021-12-08 07:14:08","false","feat: don't do lookups from taps when the puck is inactive",7,59,1
"birchill/10ten-ja-reader","97b47418254a4eed9f2c333f56e172eef0df5654","birtles","2021-12-16 05:32:59","false","chore: update CHANGELOG.md",6,59,1
"birchill/10ten-ja-reader","9d476df795a8ec887a8e8db951c24a67a0987f10","birtles","2021-12-16 05:30:16","false","chore: update words snapshot",6,59,1
"birchill/10ten-ja-reader","e79390aec02b1fed2dab53cbc53af4babcac746c","birtles","2021-12-08 08:09:41","false","chore: update word snapshot",7,59,1
"birchill/10ten-ja-reader","211955167e032b0bba6a6dab0db5247742fb3031","birtles","2021-12-08 07:43:38","false","fix: make sure to clear the  property of the events we pass on",7,59,1
"birchill/10ten-ja-reader","5cf87d6d1908930d0fadf26737e35394decac6ff","birtles","2021-12-09 02:10:25","false","v1.6.0",6,59,1
"birchill/10ten-ja-reader","286e3c82125e8554abd93ca90484f34fde8385bb","birtles","2021-12-08 07:08:30","false","chore: work around Safari bugs",7,59,1
"birchill/10ten-ja-reader","05745b58fa435cc9ed6b5252cbe57a49a513035d","birtles","2021-12-08 06:38:30","false","chore: update changelog",7,59,1
"birchill/10ten-ja-reader","8ad34e7a50a611e3ea90993c856b976deba19da2","birtles","2021-12-07 05:58:27","false","feat: do look ups based on taps

Fixes #845",7,59,1
"birchill/10ten-ja-reader","0921b3f7aedee654b83b66a19d5c4e925bc190f6","birtles","2021-12-16 05:32:05","false","v1.6.1",6,59,1
"birchill/10ten-ja-reader","69bb5757a989ea1a9e2ce1551385e9de56a6ec5d","birtles","2021-11-05 11:38:46","false","chore: rename gdocs-fallback to gdocs-bootstrap",6,58,1
"birchill/10ten-ja-reader","b484a363598cb221180d086f0719dfe34662235e","birtles","2021-12-02 06:01:50","false","chore: tighten up HTML generation a little further still",8,59,1
"birchill/10ten-ja-reader","53cab9e31de582538c6c84f40839cc429e962ccb","birtles","2021-12-02 07:49:23","false","chore: don't render the copy overlay when we don't need it",8,59,1
"birchill/10ten-ja-reader","22e640bd69918ec680846d40d6f39bd6a18a1608","birtles","2021-11-29 05:48:47","false","chore: refactor copy state",7,58,1
"birchill/10ten-ja-reader","d4910a68e6d2930ff07fea4e3c41478480ce4544","birtles","2021-12-06 09:28:52","false","chore: update changelog",8,59,1
"birchill/10ten-ja-reader","90bc33028e6807ba45716d05971fe85a0beb9ff8","birtles","2021-12-06 05:51:02","false","fix: restore status bar roll up effect",8,59,1
"birchill/10ten-ja-reader","560ccf22db27bd85061e08dad58b4a3f264ffe10","birtles","2021-12-02 07:25:18","false","fix: fix a few bugs with the handling of the finished copy state",8,59,1
"birchill/10ten-ja-reader","b7b7b3fdcb2344378a4b924dcc22cc3d6fffcf4f","birtles","2021-11-05 07:56:15","false","fix: calculate text selection bboxes for gdocs spans",6,58,1
"birchill/10ten-ja-reader","2ce21a47ffcd9869885564cbe7b931f680ce2454","birtles","2021-11-26 06:01:54","false","chore: make database status shown in options page more accurate

See issue #840.",7,58,1
"birchill/10ten-ja-reader","b94015ffe788b6b702047e9be89f27847cf82e0f","birtles","2021-11-26 07:13:56","false","chore: fix typo",7,58,1
"birchill/10ten-ja-reader","2259d587420fa40110f290ff9ecaa9aa2baa0bf1","birtles","2021-11-26 06:32:43","false","chore: try to ensure the port between the options page and the background page stays alive

see https://github.com/birchill/10ten-ja-reader/issues/840#issuecomment-979515228",7,58,1
"birchill/10ten-ja-reader","4f32a8527b4d4dbde06bad8eed664c19264ee4c0","birtles","2021-11-09 04:56:37","false","fix: extend timeout and interval for fetching FX data

Some folks are still hitting timeout errors it seems. Maybe this will
help. Who knows.",6,58,1
"birchill/10ten-ja-reader","b01b78d51330b75a448ad26e25642d37e4138548","birtles","2021-11-05 11:45:55","false","chore: add gdocs-bootstrap to Xcode project",6,58,1
"birchill/10ten-ja-reader","e8e46e0c6298ed6d0bb68fec5b18fdd5c45e7a86","birtles","2021-11-06 02:36:15","false","chore: Update CHANGELOG.md",6,58,1
"birchill/10ten-ja-reader","04483208fcf60c7e374ce26193b528d48d12c5ee","birtles","2021-11-09 02:57:23","false","fix: update translation of annotation for irregular headwords

As Tom Ikeda points out by email:

> You render the iK (irregular kanji) tag as ""rare"", but these forms
> aren't necessarily rare; they're just irregular/non-standard. They're
> often quite common - sometimes very common. Recently an rK (rare kanji)
> tag was added for standard forms that aren't commonly used. I suggest
> using ""rare"" for this, and ""irreg."" or ""non-std."" for iK.",6,58,1
"birchill/10ten-ja-reader","0237dbb81a6487036b4e07b6b9dee55b8b2c28bf","birtles","2021-11-06 05:24:55","false","chore: drop legacy 'search' message type",6,58,1
"birchill/10ten-ja-reader","fa986f5d187910a7096d69c29209e85e977d2915","birtles","2021-11-06 05:15:47","false","fix: use var for bootstrap script in case it is injected twice",6,58,1
"birchill/10ten-ja-reader","7892a405cff7712da4bfa5bc4834556f72b79ebc","birtles","2021-11-06 05:23:27","false","chore: update words snapshot",6,58,1
"birchill/10ten-ja-reader","26f233a18b42456e4c807198050ff29f5c8462cc","birtles","2021-11-08 00:33:53","false","v1.5.0",6,58,1
"birchill/10ten-ja-reader","ccff9c3fe6b3474ae98284499c15bb8e3475f2e2","birtles","2021-11-06 05:21:43","false","chore: update CHANGELOG.md",6,58,1
"birchill/10ten-ja-reader","73338d0d3ed0049db780ff9541904b36d1be6045","birtles","2021-10-29 01:56:45","false","chore(deps-dev): update web-ext-plugin to 1.4.0",6,57,1
"birchill/10ten-ja-reader","d66efe0ee1c48e2b381420ba9c8980a4bb3a442c","birtles","2021-11-04 00:08:33","false","feat: replace '(trademark)' annotation with TM symbol",7,58,1
"birchill/10ten-ja-reader","5317ef3e87fd9d9dd59dbe4bbd1c6c413a8682b3","birtles","2021-11-05 01:21:20","false","fix: expose hold-to-show keys in active-tab mode too

Fixes #818.",7,58,1
"birchill/10ten-ja-reader","6b8a132442be722d2a066da60fb3662dcc8c37cb","birtles","2021-11-04 04:21:04","false","chore: make annotated canvas elements hit-testable",7,58,1
"birchill/10ten-ja-reader","eb72e74b10d333b771c049df371a9a6675dafe63","birtles","2021-11-04 04:10:39","false","chore: switch to annotated canvas mode (and drop pref for HTML fallback)",7,58,1
"birchill/10ten-ja-reader","9cfec698d6ce96b10cbbc2b4b571ad54e033ed4d","birtles","2021-11-05 06:11:38","false","fix: clear gdocs selection",6,58,1
"birchill/10ten-ja-reader","e90121c15226769566c3aaef8dfb9c27bd779f50","birtles","2021-11-04 06:05:04","false","chore: factor out a isGdocsOverlayElem function",7,58,1
"birchill/10ten-ja-reader","88db9295cf3d4141079bdc237c2c5b41a76e74da","birtles","2021-11-04 06:14:14","false","feat: lookup words that cross lines",7,58,1
"birchill/10ten-ja-reader","973f862f78de74f929f3bf93ebd637dc6653c7fa","birtles","2021-11-04 06:43:01","false","fix: proper span handling",7,58,1
"birchill/10ten-ja-reader","7ebbc1d4328ebef124b5da6b63c1628a592fe103","birtles","2021-11-04 07:20:44","false","feat: initial start on gdocs selection",7,58,1
"birchill/10ten-ja-reader","57a9adabe6151e222f35529a8e3054b94e30348e","birtles","2021-11-05 02:13:29","false","fix: highlight all the spans in the matched text",6,58,1
"birchill/10ten-ja-reader","5dc8c8887e5a085923b497fd5cf4ea1e7d5aeae6","birtles","2021-11-05 01:07:41","false","fix: serialize gloss types along with their glosses when copying",7,58,1
"birchill/10ten-ja-reader","6820a9611b1c0deaa61526fd67a643654fe61339","birtles","2021-11-05 07:38:26","false","fix: get keystrokes to work in Google docs",6,58,1
"birchill/10ten-ja-reader","d55abac82ff86fc295d3f0b391af9b0834d55393","birtles","2021-11-04 01:23:13","false","feat: show the age next to people with birth dates",7,58,1
"birchill/10ten-ja-reader","df07d1c965b5d068c98207a2dd6c7c5a8b663f0e","birtles","2021-11-01 01:04:05","false","fix: recognize ""Alternatif"" key

We've seen this appear on Edge at least once.",6,58,1
"birchill/10ten-ja-reader","4cd3c692c084310f4ae652b8b7c49ce8e994d04b","birtles","2021-11-05 02:22:13","false","fix: position highlight relative to scrolling container",6,58,1
"birchill/10ten-ja-reader","1cffe4e2e0002774762105e6e576f31526d4e406","birtles","2021-10-21 01:00:07","false","chore: Update words snapshot",9,57,1
"birchill/10ten-ja-reader","d0007974a00a16b26b6a318735cc995329830be8","birtles","2021-10-21 01:10:48","false","v1.4.8",9,57,1
"birchill/10ten-ja-reader","ede0e04369aff7963085ca9c4698b67d93369b92","birtles","2021-10-19 03:06:46","false","fix: Fix iframe origin calculation for iframes with border / padding.

Fixes #803.",10,57,1
"birchill/10ten-ja-reader","1bcd904d302bf600ca828d3182660e653a851ff7","birtles","2021-10-27 02:00:04","false","fix: Don't lookup strings that are only digits in the name dictionary

Fixes #811.",8,57,1
"birchill/10ten-ja-reader","a89d5cf1e2c5b9ef55d8ddae7f3ddd4cac9abfe6","birtles","2021-10-08 06:54:36","false","chore: Factor out a separate method for formatting currencies",8,57,1
"birchill/10ten-ja-reader","5ad32fb54c6cc966f1c0b09a5a9eb5041c9ab183","birtles","2021-10-08 07:14:46","false","chore: Update changelog",8,57,1
"birchill/10ten-ja-reader","c0e23ab429cfed316d0b5120ed5a981856137d8e","birtles","2021-10-08 08:33:56","false","fix: Further fixes to currency data update scheduling",8,57,1
"birchill/10ten-ja-reader","c115168d35df635f7019fa0ba523812fa9d9f769","birtles","2021-10-08 08:37:18","false","v1.4.5",8,57,1
"birchill/10ten-ja-reader","e6edfefd72932fbb2691add9879295bb07022897","birtles","2021-10-08 08:54:45","false","chore: Try adding a CJS wrapper around ESM GitHub action runner",8,57,1
"birchill/10ten-ja-reader","b3bdc5fc0e9ce8d3b269f69427d9307d371ba509","birtles","2021-09-25 09:11:47","false","chore: Tidy up comment",10,56,1
"birchill/10ten-ja-reader","353cf119771d129d53bda358f6b89176e2dc70c3","birtles","2021-10-14 03:37:48","false","fix: Stop the safe area from interfering with interactive standalone SVG files

It turns out that our support for standalone SVG graphics is completely
broken but at least we can stop it from interfering with content for
now.

Fixes #793.",10,57,1
"birchill/10ten-ja-reader","15d8559f0b267502559f6fceab0a61352981b5ff","birtles","2021-10-14 04:13:16","false","fix: Make the popup show on standalone SVG graphics again",10,57,1
"birchill/10ten-ja-reader","51120c6937c600ba33c901a72c2ab4be11a4925b","birtles","2021-10-08 07:11:47","false","chore: Update words snapshot",8,57,1
"birchill/10ten-ja-reader","c4d0c107931e98d240865e366ec847e66479d845","birtles","2021-10-08 07:52:41","false","chore: Convert read-package-version action to a module",8,57,1
"birchill/10ten-ja-reader","57b6e1897dadd8235948650dcd27fe99ae4ea5d2","birtles","2021-10-08 09:44:41","false","chore: Update changelog",8,57,1
"birchill/10ten-ja-reader","8d60c38a971b7638ca9f409db174dff4c2935b97","birtles","2021-10-08 09:03:29","false","chore: Fix a silly bug in read-package-version script wrapper",8,57,1
"birchill/10ten-ja-reader","e1db8646a7903373519e27b7020afc53bd57fa55","birtles","2021-10-01 04:33:30","false","fix: Make a few more functions handle non-BMP characters better",9,57,1
"birchill/10ten-ja-reader","84225a8f76261a230ed83a466d91afd23700abd4","birtles","2021-09-30 07:43:29","false","fix: Cancel the click event when closing the popup",10,57,1
"birchill/10ten-ja-reader","e98f62b0b9011887bb195bada1590873e294d709","birtles","2021-10-04 01:37:12","false","fix: Avoid a situation where we continually request updated FX data",8,57,1
"birchill/10ten-ja-reader","3ceb27f104693c45ec44d6e27a97a36c10663d30","birtles","2021-10-01 04:27:31","false","fix: Better handle `-webkit-user-select: none` content in Safari

Fixes #773.",10,57,1
"birchill/10ten-ja-reader","be7d6e4668fcbf5e3944e2de82d5ecd8e6ea30ab","birtles","2021-10-06 00:17:55","false","fix: Fix translation of update error dates in Chromium browsers",8,57,1
"birchill/10ten-ja-reader","b7730f1b1a23b6c155ee81fc538e6c1f191ccf41","birtles","2021-10-01 04:36:06","false","chore: Update word snapshot",9,57,1
"birchill/10ten-ja-reader","d052639a302489d63f7f00bb86475f90fbcdedbd","birtles","2021-09-30 11:21:37","false","fix: Force Google Docs to HTML mode

Heavily assisted by:

https://github.com/melink14/rikaikun/commit/94b60a64303d60ff08a05e71ec706a33da346821

This is likely not going to work for long. See:

https://github.com/birchill/10ten-ja-reader/issues/782#issuecomment-931201472

Fixes #782, for now anyway.",11,57,1
"birchill/10ten-ja-reader","94fa54328e2148de86088f4107efabf349baed63","birtles","2021-10-01 04:56:59","false","chore: Fix release script",9,57,1
"birchill/10ten-ja-reader","c1bc552cbb3d17f44a2cad6c4a1640e5972070aa","birtles","2021-10-07 23:25:08","false","fix: Use canonical currency data path",8,57,1
"birchill/10ten-ja-reader","53e6a8d9e02ab03a0a7911dd8364296989c1c5e2","birtles","2021-09-30 12:25:30","false","fix: Ignore zero-width non-joiner characters",10,57,1
"birchill/10ten-ja-reader","7e5846934b35bfe5c3046bc571a6708279e6ccb6","birtles","2021-10-05 23:21:42","false","fix: Check tab is defined before trying to access it",8,57,1
"birchill/10ten-ja-reader","f348b3a02b934081fe624dc6e9cc822b2d8069f1","birtles","2021-09-23 03:14:21","false","chore: Update logging for currency data fetching and extend timeout",9,56,1
"birchill/10ten-ja-reader","217aba74cc4b17aceb547bbb134c0e8db0ab55dc","birtles","2021-09-24 08:29:18","false","chore: Update Safari build instructions",10,56,1
"birchill/10ten-ja-reader","94d87d1c1928074ee98b2572dece5aacbbef3c17","birtles","2021-09-14 05:34:56","false","fix: Fix major performance regression",10,56,1
"birchill/10ten-ja-reader","f2596bf045c4c8e6cedfe6900c2bbaf7f8556240","birtles","2021-09-23 02:15:12","false","chore: Tidy up extension storage error logging",9,56,1
"birchill/10ten-ja-reader","a5f0479210b4dafb0b830d02eba52c0a4e8b2b19","birtles","2021-09-24 08:02:45","false","fix: Recognize Chrome network errors",10,56,1
"birchill/10ten-ja-reader","534b2ff02baf1742e371601739ea5f055f0077b7","birtles","2021-09-23 13:09:33","false","v1.4.2",9,56,1
"birchill/10ten-ja-reader","9a8ff0a12614fcbbe371d61d6df4affbd17ecf1b","birtles","2021-09-24 02:05:06","false","chore: Fix building on Mac",10,56,1
"birchill/10ten-ja-reader","7cd58ad9cdb78e24cabde2adb02caab8bed88afa","birtles","2021-09-25 05:02:06","false","fix: Drop redundant currency codes",10,56,1
"birchill/10ten-ja-reader","a0b4adb6fc6157d3c0018a908abe7509eaaab36e","birtles","2021-09-25 06:01:35","false","feat: Fix BTC formatting",10,56,1
"birchill/10ten-ja-reader","3669cd7b6f40ceac2b7aad8273df0b8e2f911124","birtles","2021-09-23 03:41:58","false","chore: Add debugging for JSON parse errors",9,56,1
"birchill/10ten-ja-reader","7346e06a5ce57052d42dba8e27fbfed11f5cce0b","birtles","2021-09-23 12:49:14","false","chore: Update changelog",9,56,1
"birchill/10ten-ja-reader","1559d39988d0d093963e440b94e0038ec516ccce","birtles","2021-09-25 02:59:41","false","feat: Expand regular numbers",10,56,1
"birchill/10ten-ja-reader","baa4bf717e20deac640aaab6d5b0e2aac83411a4","birtles","2021-09-25 00:28:30","false","fix: Recognize Forbidden 403 code as well",10,56,1
"birchill/10ten-ja-reader","8b0e54365d2cc448d012e5781a343ea3bb6c1f1e","birtles","2021-09-23 03:33:44","false","fix: Add workaround for clocks that are a few hours out of sync",9,56,1
"birchill/10ten-ja-reader","e7a7c3a505035b8c6dcf58d20e3629af3aa2b1c1","birtles","2021-09-24 08:38:00","false","fix: Fix TypeScript error",10,56,1
"birchill/10ten-ja-reader","b289fa4e19dd956766ee2b465c47ff139fdb9b2d","birtles","2021-09-23 03:26:38","false","chore: Convert TypeErrors that represent NetworkErrors into DownloadErrors",9,56,1
"birchill/10ten-ja-reader","84967302e19857e2e8bb4591c2a7e0b8557c9b8d","birtles","2021-09-24 08:56:04","false","chore: Re-instate script to generate source bundle

The bundle generated by GitHub includes _everything_ including all the
iOS onboarding assets which swells the zip file from ~10Mb to over 40Mb
and is too much to upload to AMO.",10,56,1
"birchill/10ten-ja-reader","4dde6136a0a8dad715e46532e3c30f3091eafdff","birtles","2021-09-25 04:20:43","false","feat: Add option to disable currency conversion, falling back to number expansion when appropriate",10,56,1
"birchill/10ten-ja-reader","0fc111d413b10c7ffca07ff62225de19ec55633a","birtles","2021-09-23 04:06:36","false","chore: Fix path to tab manager in Safari build",9,56,1
"birchill/10ten-ja-reader","57290f0846d7a624a0d1365940c7a0d7198120fa","birtles","2021-09-24 08:03:52","false","fix: Revert attempt to fetch text from response that failed to parse as JSON

You can't read the buffer twice so if response.json() fails that's it.",10,56,1
"birchill/10ten-ja-reader","0192d20e200130d39d4b45b6fb600e3011bc4184","birtles","2021-09-20 01:29:51","false","fix: Wrap call to tabs.query in try/catch",8,56,1
"birchill/10ten-ja-reader","0f1311560465e4135a35652a26986ed1d0151913","birtles","2021-09-20 09:28:51","false","fix: Handle missing data case better",8,56,1
"birchill/10ten-ja-reader","891cbc658e53d22bac217598fb39c565e861cb11","birtles","2021-09-23 01:28:07","false","fix: Increase z-index of popup and puck",9,56,1
"birchill/10ten-ja-reader","a15400fb8d525bd978471cf218a7b349bba21b9c","birtles","2021-09-20 01:45:29","false","fix: Prevent double taps on the puck from being treated as a zoom gesture",8,56,1
"birchill/10ten-ja-reader","8bf6b8477407f61919e1cc3fba3aa1b771e699ae","birtles","2021-09-20 08:13:27","false","chore: Update word database snapshot",8,56,1
"birchill/10ten-ja-reader","61a0073a98fb997f11a2cdce26a9fb52df7c1cea","birtles","2021-09-16 05:24:07","false","feat: Show currency conversions",7,56,1
"birchill/10ten-ja-reader","2d5642748ec503e050b1b5132fdfa5461712e8ac","birtles","2021-09-14 08:39:21","false","chore: Stop managing so much iframe metadata in the background page",10,56,1
"birchill/10ten-ja-reader","fd5d093794d60842849bef2b2184bd2e9f86de8b","birtles","2021-09-14 23:49:10","false","v1.3.5",9,56,1
"birchill/10ten-ja-reader","3e2b18069ca6384a1da02fc2f611b0343bbfa365","birtles","2021-09-15 01:31:24","false","chore: Update TabManager interface",7,56,1
"birchill/10ten-ja-reader","6f8dcc432b114e3543f7edf2e4ccd4d2a7287a48","birtles","2021-09-15 07:50:00","false","chore: Add downloading and configuring of fx data",7,56,1
"birchill/10ten-ja-reader","e06eb6f28ecf18c5c43fb059ca6b09146c7435a0","birtles","2021-09-15 01:33:18","false","chore: Make TabManager callbacks take a property bag",7,56,1
"birchill/10ten-ja-reader","57d7cfd48b5334c1b11656827a8ae7fb81a157bf","birtles","2021-09-14 09:32:42","false","fix: Start up the puck if we become the effective top-most window",10,56,1
"birchill/10ten-ja-reader","995eb613b6402df746a6437a99d8f3c01896bc4a","birtles","2021-09-16 06:44:00","false","fix: Make popup window more responsive, especially when displaying currency info",7,56,1
"birchill/10ten-ja-reader","faabb612914ec8b1f45aad91553f6e7122034783","birtles","2021-09-15 00:30:28","false","feat: Drop build-time flag for puck and enable it by default",9,56,1
"birchill/10ten-ja-reader","1711858196b41785a83438289fd6109e952ed0c4","birtles","2021-09-16 00:44:18","false","chore: Update changelog",7,56,1
"birchill/10ten-ja-reader","a07e587fb3f34380397ef14a207d79f7e2d4c5ad","birtles","2021-09-14 11:16:16","false","chore: Update changelog",9,56,1
"birchill/10ten-ja-reader","e06f4bdccc01a777381e474270f48bd48385b1a7","birtles","2021-09-15 01:36:07","false","chore: Add 'anyEnabled' member to data passed to tab manager listeners",7,56,1
"birchill/10ten-ja-reader","e04e81da35fbb22270bc814c0d3c669fe66d451c","birtles","2021-09-14 12:12:59","false","chore: Tweak puck shadow too",9,56,1
"birchill/10ten-ja-reader","71627b0a819fa00666eec498b38a0429aed204e7","birtles","2021-09-15 22:57:57","false","fix: Ignore errors when sending to child tabs

We seemed to get a lot of errors here -- perhaps this is being
dispatched when a tab is closed etc.?",7,56,1
"birchill/10ten-ja-reader","3b2744c5343dea27f58d423eff75359fc93b6686","birtles","2021-09-08 08:25:30","false","fix: Fix various bugs",10,56,1
"birchill/10ten-ja-reader","f62fa3872fea2b84fcf8747807c099064b6837f9","birtles","2021-09-08 22:42:51","false","fix: Stop the popup from showing for plain numbers

Fixes #749.",11,56,1
"birchill/10ten-ja-reader","54a5af37ea39c2d3801403d4e412c19a93fcc7ad","birtles","2021-09-08 12:23:28","false","fix: Detect if puck is enabled before trying to set options",10,56,1
