"name_with_owner","sha","author","date","verified","message","num_issues","commit_month","has_ci"
"birchill/10ten-ja-reader","7dbd139a2edcf7a624260dd9f922ff9f9e08047d","birtles","2019-01-25 08:59:23","false","Tidy up formatting somewhat",10,24,0
"birchill/10ten-ja-reader","0f223be9acb2df7a5ba4230caa34bdd890fee1cf","birtles","2022-05-11 12:26:41","false","chore: rename applications to browser_specific_settings in manifest",4,64,1
"birchill/10ten-ja-reader","0ed55646a6c4650fc71465b70fef25a5660ed0c1","birtles","2019-11-27 01:03:27","false","Make sure assets have unique names in non-prerelease versions",13,34,0
"birchill/10ten-ja-reader","7a6376858277132360fb38fd1765a6080baa9105","birtles","2019-10-18 02:11:32","false","Tidy up readings styles a bit",12,33,0
"birchill/10ten-ja-reader","46bed566bec62e6b2fd24fd7771f143df6df0101","birtles","2021-04-07 00:20:04","false","Only prioritize by matched headwords when using fallback dictionary

This basically just applies the following fix to hikibiki-data to the
fallback behavior:

  https://github.com/birchill/hikibiki-data/commit/22b279fb72ab1f76880584147ab884fc915840df

You can notice the difference when looking up text such as いま using
the fallback dictionary (with this fix 今 will sort first, without it 馬
will sort first).",13,51,1
"birchill/10ten-ja-reader","7928ea7b70163cdea4683c2bec8491ba295ab9e6","birtles","2018-05-10 04:01:40","false","Upgrade package-lock.json again",16,16,0
"birchill/10ten-ja-reader","b5605e01fedbbe4f5e58e8320358d1484ff4b1a6","birtles","2018-10-26 00:55:20","false","Update message when copying fields",14,21,0
"birchill/10ten-ja-reader","6a64f53566f7573ed1e1ad7686242ffd14773aa1","renovate-bot","2022-05-13 05:57:11","true","chore(deps): update dependency karma to v6.3.20",4,64,1
"birchill/10ten-ja-reader","a0b6407e556ab0f9f3d45987ce3083530803999b","birtles","2022-02-18 04:34:23","false","chore: add renovate.json",5,61,1
"birchill/10ten-ja-reader","21b598fcd7d85a0d31126a9ef18f203378720db0","birtles","2018-07-26 01:28:19","false","Add more logging to file loading",14,18,0
"birchill/10ten-ja-reader","849de961894f049967837d395062ee7569bc6e29","birtles","2018-07-28 01:46:21","false","Update word and names dictionaries to 2018-07-27 snapshot",14,18,0
"birchill/10ten-ja-reader","b343559dfb015d54655c7b48aaeec99c179399fc","birtles","2017-08-29 23:28:30","false","Fix a few more TypeScript errors",0,8,0
"birchill/10ten-ja-reader","c92713611b21df2d30ea53689a7078d35c2c1d4a","birtles","2017-08-21 13:01:48","false","Add tests for deinflection and tidy up code",0,7,0
"birchill/10ten-ja-reader","169962c6d62d2e0d3dd8dce011abffd0ec57c269","birtles","2021-08-30 00:59:50","false","chore: Update contributors section",11,56,1
"birchill/10ten-ja-reader","2625b340f9b2acdd89ea435a49ef5afe420b2664","birtles","2021-09-14 00:49:38","false","feat: Make puck icon match the toolbar icon",9,56,1
"birchill/10ten-ja-reader","3620e6d16e952d2f435524f707e0540815caf4f6","birtles","2019-10-21 07:36:37","false","Further tweak kanji display",12,33,0
"birchill/10ten-ja-reader","9b3e2ba96a75acb00dbf475d758554ff847c4579","birtles","2021-09-20 11:55:05","false","chore: Update CHANGELOG.md",8,56,1
"birchill/10ten-ja-reader","046a27c2c5a453aac4e1562a050a2aa02656b23a","birtles","2018-12-29 09:17:24","false","Extract the mapping between name tags and strings to a separate file",11,23,0
"birchill/10ten-ja-reader","7602afd1b224ee9b2c0cea9852e4870c94dddb32","birtles","2018-05-28 04:37:43","false","Preprocess manifest.json to produce separate version for Firefox / Chrome",15,17,0
"birchill/10ten-ja-reader","7f8bdd94c2dc6689bb1f5c553b1f889fabefbf3d","birtles","2017-09-04 04:24:02","false","Fill in more of HTML generation function",0,8,0
"birchill/10ten-ja-reader","0ecb2458af8725f261db2cc0d5ddcfa4919d08ef","birtles","2017-08-25 05:03:20","false","Upgrade version of slimerjs fork",0,7,0
"birchill/10ten-ja-reader","f6f70e995295e79f949025f4fb2edfd9a6005f63","birtles","2017-08-16 07:55:28","false","Prettify code",0,7,0
"birchill/10ten-ja-reader","21cd84bc4771d2393091d2f6d83c3347f00e143c","birtles","2022-05-13 01:48:55","false","chore: use data.10ten.study to generate snapshot data",4,64,1
"birchill/10ten-ja-reader","989175bbf412db975e47e44fa6c549bf1e62eb8c","birtles","2018-08-21 06:13:37","false","Allow changing the key part of a command",14,19,0
"birchill/10ten-ja-reader","15fb813096cab20cadf094b50c064a46f1286441","birtles","2017-11-09 10:16:19","false","Drop feature that lets you adjust pop-up vertical position using j/k

I can't imagine anyone ever uses this.",3,10,0
"birchill/10ten-ja-reader","81ef37238d727703f6770b992818c38344b34367","birtles","2018-02-12 23:46:42","false","Add context-* properties to disabled icon even though that won't work yet

For rationale why this doesn't work, see:

https://searchfox.org/mozilla-central/rev/9d47b5fb14152865ad1375eb3ee2e571d81ecdb9/layout/svg/SVGContextPaint.cpp#60-64",11,13,0
"birchill/10ten-ja-reader","9bb00b28f6d4ab2b0b7467c9574afdd7e47554f2","birtles","2018-05-10 23:32:16","false","Fix travis error. Maybe.",16,16,0
"birchill/10ten-ja-reader","d7100fdf0767da4c076b3fbb182abc26bbd55624","birtles","2020-11-03 07:42:02","false","Flatten word result objects",17,46,0
"birchill/10ten-ja-reader","db8ce97e10de6ec3d0bef610136a10689dd9a4da","birtles","2020-11-12 01:32:02","false","Style sense info a little",17,46,0
"birchill/10ten-ja-reader","75d505d9f27705d61084d863e22e7af33434d3e0","birtles","2021-06-19 01:09:38","false","fix: Drop tabs permission from manifest",9,53,1
"birchill/10ten-ja-reader","f1b1cf6075fe956fb19713ae504482dabf778e84","birtles","2018-12-28 04:01:37","false","Re-use browser-polyfill in popups test file",14,23,0
"birchill/10ten-ja-reader","ea56baf28643531240c320a6b43c2fcc94f8813a","birtles","2021-05-18 04:42:07","false","Try cropping some screenshots",10,52,1
"birchill/10ten-ja-reader","a826490d72440a40a9ff16548e59800f0fbdfbde","birtles","2019-11-26 03:53:49","false","First pass at adding some release steps",13,34,0
"birchill/10ten-ja-reader","b40004e03dd75863137cea803d028321fb28000d","birtles","2018-08-22 05:26:40","false","Catch errors from updating keys",14,19,0
"birchill/10ten-ja-reader","337323e9cfc5f8f951089dc0bfcc513adcc22c82","birtles","2021-06-17 07:46:02","false","fix: Fix a bug in lookup cache",9,53,1
"birchill/10ten-ja-reader","891a688e74019cfb61a7d0cb6b3d0a190aac54f0","birtles","2017-10-18 03:36:44","false","Add some rudimentary support for SVG documents",0,9,0
"birchill/10ten-ja-reader","1c3d0823b1287631c6ec1e78e4d6e89d4fa49bdd","birtles","2017-10-14 08:52:20","false","Respect onlyReading setting when generating HTML",0,9,0
"birchill/10ten-ja-reader","b10bfc3edf0658ef7a9c5381db087b25987d52bb","birtles","2017-10-02 00:08:43","false","First steps towards handling input/textarea",0,9,0
"birchill/10ten-ja-reader","fa949d58bf0a9171f559474fe7e525b0745aab52","birtles","2017-08-28 22:56:18","false","Use Firefox 55 now until shutdown hang is resolved",0,7,0
"birchill/10ten-ja-reader","48b861b088f0dfed4e3fcb0b2f64305b273694c6","birtles","2017-01-12 07:08:58","false","Fix various bugs",0,0,0
"birchill/10ten-ja-reader","2b7eda6e93d7a40b712be9d80306d7fddcd85f89","birtles","2018-08-27 03:45:11","false","Add wishful preventDefault

We don't seem to be able to stop Alt from triggering the menu. Maybe
there's a way, but I haven't found it. preventDefault probably should
work so we add it for now in case it starts working at some point.",12,19,0
"birchill/10ten-ja-reader","3e4b6fb733d06364df6ea9eaaa3298371afed597","birtles","2021-08-30 00:51:54","false","feat: Add a compile time switch for enabling the puck

For now it is enabled by default.

To enable it we need to use, e.g. `ENABLE_PUCK=1 yarn start:firefox`
etc.

In future we will convert this to a runtime switch.",11,56,1
"birchill/10ten-ja-reader","0386373cd54590774b5ec7955914fdb10c28c856","renovate-bot","2022-05-24 19:42:24","true","fix(deps): update dependency typescript to v4.7.2",6,64,1
"birchill/10ten-ja-reader","15fa12fdc1786b0eb4dc4cdd2949f7de61acaf19","renovate-bot","2022-03-02 19:05:33","false","fix(deps): update dependency superstruct to v0.15.4",5,62,1
"birchill/10ten-ja-reader","1e59afe2735940dfdd631ee8817d9a0891090e0e","birtles","2021-09-22 06:26:07","false","chore: Bump Xcode version numbers",8,56,1
"birchill/10ten-ja-reader","b9d46b8b3a8d441b1a94a3612c2b7d758c659c95","birtles","2018-08-08 03:24:26","false","Inrease load time warning to 30s

This is only a warning so it really doesn't help to have it happen so
often.",14,19,0
"birchill/10ten-ja-reader","549a78f89d78f187237fb27f80df84cce5201998","birtles","2021-08-27 01:29:38","false","fix: Account for when window.top is null",11,55,1
"birchill/10ten-ja-reader","589050bbff7e36f54dd2c948bf4f7e3e5f2230a7","birtles","2019-11-29 05:47:12","false","fix: Group database unavailable errors together",12,34,0
"birchill/10ten-ja-reader","a315fccbdcebbb73c67457851e957e55c8a6d514","birtles","2022-05-19 03:14:41","false","feat: add colored progress bars",5,64,1
"birchill/10ten-ja-reader","796ebd6c04b1a7e24f014b4f8dfe3bc102ed8845","birtles","2021-07-29 01:44:18","false","chore: Add offline_enabled field",11,55,1
"birchill/10ten-ja-reader","0b4a08eef6fe4bcf2688247f6858e051416ee5c8","birtles","2019-12-04 06:46:59","false","Make failed downloads resume from more recent failure",12,35,0
"birchill/10ten-ja-reader","27bba80684fadd891f0c8abb5115b86e0b9301e7","birtles","2020-11-16 04:26:06","false","Localize gloss types used in copy-text",17,46,0
"birchill/10ten-ja-reader","f0ac605ca59feefd240421bdcf2069fc10d0db52","birtles","2021-09-22 06:22:28","false","v1.4.1",8,56,1
"birchill/10ten-ja-reader","8a1c24bc8d37fe1a3b10df81d358f15db1b549ff","birtles","2017-08-31 23:54:28","false","Tidy and test translate method",0,8,0
"birchill/10ten-ja-reader","ea35645bcc25448c8d49d6ebd9f221c2f7b48d20","birtles","2017-08-30 23:40:07","false","Add comment about observed bug",0,8,0
"birchill/10ten-ja-reader","ba71cf32aac50876f706a50a70a27e11de8b32e7","birtles","2022-04-07 06:43:07","false","chore: add completely-untested-definitely-thoroughly-broken Firefox release task",6,63,1
"birchill/10ten-ja-reader","963a70a9d51d0b3e75c4e3e4392263a26732c7b7","birtles","2021-05-17 02:35:50","false","Stop generating separate source package

See #600.",12,52,1
"birchill/10ten-ja-reader","9dd10c7972f90b22b709c48026834d2edc5c5f36","renovate-bot","2022-03-14 21:49:04","true","chore(deps): update typescript-eslint monorepo to v5.15.0",7,62,1
"birchill/10ten-ja-reader","effddce5fcfa3bb9219aff94112ea1cfe8cc1405","renovate-bot","2022-05-17 15:47:59","true","chore(deps): update typescript-eslint monorepo to v5.25.0",4,64,1
"birchill/10ten-ja-reader","6f643eebf8191ad76922a74165a59c57fd0656ff","renovate-bot","2022-03-16 06:31:19","true","fix(deps): update dependency lint-staged to v12.3.6",6,62,1
"birchill/10ten-ja-reader","8d72ff0c77166fdb7583f54f71746695a68cf850","birtles","2017-11-18 12:40:36","false","Update dictionary",6,10,0
"birchill/10ten-ja-reader","a947b1dde3fcb7da67f56bbbb69c7158e0cafa8e","birtles","2017-12-20 00:37:15","false","Bump version to 0.0.13",9,11,0
"birchill/10ten-ja-reader","6515e31a0940a2e90fd6c40d6c884952383552ff","birtles","2018-07-14 05:30:25","false","Update dictionaries to 2018-07-13 snapshot",12,18,0
"birchill/10ten-ja-reader","60b8a93a0664d0472cee1285a76abe7a6969758a","renovate-bot","2022-04-18 18:41:53","true","chore(deps): update typescript-eslint monorepo to v5.20.0",6,63,1
"birchill/10ten-ja-reader","db4302f0140cadd8262e1dd4ec3c9b91cc20f5e5","birtles","2017-09-24 22:45:58","false","Move test div to top of page",0,8,0
"birchill/10ten-ja-reader","f8674b8879ed37cb10db3392a0bf30da8fd85be8","birtles","2017-08-28 23:03:32","false","Fix README.md",0,7,0
"birchill/10ten-ja-reader","94767e989ed8aee5e0edf00e9330b5deee59e772","birtles","2018-11-08 09:21:29","false","Add mention of clipboard support to the changelog",13,22,0
"birchill/10ten-ja-reader","07ac578020b45e5d70a814d3a82db4682709858e","birtles","2018-11-07 23:54:07","false","Update browser-polyfill to 0.3.1",13,22,0
"birchill/10ten-ja-reader","48366d9ddc30925641145bcee355b6863cd20eaa","birtles","2021-09-20 05:20:05","false","feat: Ignore right-clicks on the puck",8,56,1
"birchill/10ten-ja-reader","3d84b421afff63e771c2115eef09caee9b80b478","birtles","2017-10-26 23:08:23","false","Fix one source of scrollable textarea jitter",1,9,0
"birchill/10ten-ja-reader","16b4c4f52a2fc3d2afdd451556246e862456510c","birtles","2021-12-06 05:50:35","false","chore: move copy class to window element",8,59,1
"birchill/10ten-ja-reader","9cbe2b291d3832a0e9f8c4b6dd27b4442fa46bdd","birtles","2018-12-28 00:23:20","false","Overhaul testing approach",14,23,0
"birchill/10ten-ja-reader","9688e3fe5e5e7ec85a11c56e8ef4e62ed27f646e","birtles","2020-09-08 04:34:28","false","v0.2.3",19,44,0
"birchill/10ten-ja-reader","0725d007b703e93f8ec26ef0817db095987c9d9a","birtles","2019-10-21 07:09:29","false","Adjust padding for kanji popup",12,33,0
"birchill/10ten-ja-reader","2ac06c5f4ebe689238ea355f338d8267687ed5cf","birtles","2019-02-24 06:23:09","false","Rework ignoring of keystrokes when a textbox is in use

See #20.",11,25,0
"birchill/10ten-ja-reader","03084bc23130f521e7c0041e83cc93e1ba780827","birtles","2020-11-16 03:27:47","false","Put certain annotations before glosses",17,46,0
"birchill/10ten-ja-reader","62122e51d06d63637c7e79bade5c383474ec73cf","birtles","2021-09-14 04:30:12","false","chore: Switch back to using postMessage for the puckMoved message",10,56,1
"birchill/10ten-ja-reader","e3c9e94671396a05883f2ce9b644541a1ac6d768","nanaya","2017-11-09 08:40:49","false","Add option to disable text highlighting",4,10,0
"birchill/10ten-ja-reader","d213bf588ce4616f2d425d4ab5e6d11bfe60f360","birtles","2021-06-17 05:25:53","false","chore: Drop no-longer-needed clipboard API declarations",9,53,1
"birchill/10ten-ja-reader","878792d8fb956f7dbcad3197385ce3000d89bfaf","birtles","2021-06-17 06:55:48","false","chore: Update words database snapshot",9,53,1
"birchill/10ten-ja-reader","b9a83ebd4537c9d055dba50446ee1e6565700130","birtles","2018-11-07 23:24:24","false","Capture key events and stop handled ones

Without this, if you press 'c' to copy an entry while on a GitHub issue
page, you'll end up creating a new issue.",13,22,0
"birchill/10ten-ja-reader","4b90e9aec3d33afdc418576931ce5c40b671478b","birtles","2022-04-28 02:07:07","false","chore: fix workflow",4,64,1
"birchill/10ten-ja-reader","75d87b598f0d7add90be18a2a3b22c3fa23ee76b","birtles","2022-05-19 07:11:52","false","fix: drop unneeded line",5,64,1
"birchill/10ten-ja-reader","ff7819a21ad88c303ef5adc3b7e227e786936129","birtles","2018-01-26 07:59:21","false","Update word and names dictionary to 2018-01-25 snapshot",10,13,0
"birchill/10ten-ja-reader","dd301f6bbdff10eff0dc0a2c7a72ea14c8a0b026","birtles","2020-11-16 04:13:23","false","Fix a few bugs with copy-text and add some tests",17,46,0
"birchill/10ten-ja-reader","83c2c469a8d2fb79fa4ac8f57fd45fdb3da4bfe3","birtles","2022-09-03 05:43:15","false","feat: tweak options styles",4,68,1
"birchill/10ten-ja-reader","3b77415414883c70318ce94673fb52e36572be9e","birtles","2018-12-28 02:43:56","false","Add initial CircleCI config",14,23,0
"birchill/10ten-ja-reader","481c00a8500df74adc602d77dfb151dea33d3149","birtles","2019-10-21 13:05:31","false","Factor out clipboard text preparation functions to a separate file",12,33,0
"birchill/10ten-ja-reader","2fd8031a4b92b2bb9f905939c2a3eaad0742a647","birtles","2021-04-06 02:06:31","false","Add further explanation about English data fallback",13,51,1
"birchill/10ten-ja-reader","9ec58e8b9e2cfd4e53beb4953616ad00884b2191","birtles","2017-11-12 23:27:55","false","Update word dictionary",2,10,0
"birchill/10ten-ja-reader","1ac789a3d3b786b7f05040526cb88231ede48de1","birtles","2017-12-20 00:08:42","false","Update word dictionary",9,11,0
"birchill/10ten-ja-reader","8119ab9cc36041aeaa3a3cefb9ba3b5e989a38e2","birtles","2017-10-20 01:12:13","false","Drop old icons",0,9,0
"birchill/10ten-ja-reader","ee60731568aad963d83964ce2b677a37195fc66b","birtles","2017-08-20 08:31:32","false","Convert wordSearch to async/await",0,7,0
"birchill/10ten-ja-reader","f94f3db3ed4015cf99b3118d39ec49fb41904247","birtles","2018-10-28 23:02:56","true","Add mention of き → 来る deinflection change",13,21,0
"birchill/10ten-ja-reader","df3fd2510b82cc26c72fac981b6ab4183b76ab19","birtles","2017-10-19 09:43:47","false","Fix definition toggling (and remove some code)",0,9,0
"birchill/10ten-ja-reader","60d75d7370e39de42caa51c4099244548c571402","birtles","2017-10-18 05:50:25","false","Tweak styles a little",0,9,0
"birchill/10ten-ja-reader","9002bef0b4a37288ce46f2f471afb2d3804eff23","birtles","2017-10-05 04:45:34","false","Re-use result when mouse hasn't moved far",0,9,0
"birchill/10ten-ja-reader","7092e3e6e80284bca26926e3306afe909867a1fd","birtles","2017-09-03 12:49:27","false","Add outline for client-side HTML rendering test",0,8,0
"birchill/10ten-ja-reader","fba53db432201d21b165f8721e865222ecc842b1","birtles","2018-08-23 00:09:25","false","Add method to check if a command is valid prior to Firefox 63",14,19,0
"birchill/10ten-ja-reader","00c9658a31b39f35fd747913da4e8fce571d6313","birtles","2017-10-30 05:02:43","false","Add comments about initial positioning bug",1,10,0
"birchill/10ten-ja-reader","39bb3a30776b8a7190d3b001d2ca6f798745801c","birtles","2021-08-12 06:43:00","false","chore: Bump Xcode version numbers",13,55,1
"birchill/10ten-ja-reader","6acef3a9885ffa3220164cda60384c9954e48c83","birtles","2018-05-23 04:05:08","false","Drop some unnecessary overhead to placate TypeScript",15,16,0
"birchill/10ten-ja-reader","77a24de51edf484c08e0f5703d1ecd168f41a2dc","birtles","2021-09-07 02:36:20","false","chore: Make ActiveTabManager index tabs by ID",10,56,1
"birchill/10ten-ja-reader","4307b1db1688c172491b0cc582b317b1fccae620","birtles","2017-10-18 13:30:35","false","Add support for switching dictionaries with Shift/Enter",0,9,0
"birchill/10ten-ja-reader","1e4c35a5161b229f3794f079c615f2079b8086f2","birtles","2017-10-11 00:34:04","false","Start using new text highlighting code",0,9,0
"birchill/10ten-ja-reader","53a0d8abd7070aa63a8ce9b4789dfc02dcf221d8","birtles","2017-10-05 23:40:55","false","Move new content methods to a separate class",0,9,0
"birchill/10ten-ja-reader","a1c9faa1e025395200a3e05cfa0185f44a7109f3","birtles","2017-10-05 04:22:23","false","Try harder to get text from elements",0,9,0
"birchill/10ten-ja-reader","0be4aa44058a19bf458ec5fdfd86fcac552a8a93","birtles","2018-08-29 03:14:35","false","Bump version to 0.0.25",12,19,0
"birchill/10ten-ja-reader","559b32d6eb376f2e753ca68cd75683be2f2f9477","birtles","2017-10-24 23:59:10","false","Make synchronization of settings work better",1,9,0
"birchill/10ten-ja-reader","3712a693742d7b0f015f354cab36a3ec2fa1fba3","birtles","2017-11-18 10:29:46","false","Updated changelog",7,10,0
"birchill/10ten-ja-reader","e487de1e00569f476da09942f34bd305ba85ad96","birtles","2018-10-07 11:08:51","false","Disable HTML generation tests",13,21,0
"birchill/10ten-ja-reader","775526c5d1b8f6c1f67ec22f8364a4418b494cc4","birtles","2018-07-28 02:00:10","false","Bump version to 0.0.20",14,18,0
"birchill/10ten-ja-reader","4456f436ddc886c73b54bd5e037160410c129cc2","birtles","2021-09-10 06:03:29","false","fix: Stop iOS from stealing pointer events after a scroll",11,56,1
"birchill/10ten-ja-reader","cd5db0a972c6c54c1d1fc421db206dbf18296eb0","birtles","2018-12-29 09:53:38","false","Tweak name tag styles a bit more",11,23,0
"birchill/10ten-ja-reader","756251484daba133e17cb5fbabd178e22faad68e","renovate-bot","2022-03-03 14:58:09","true","chore(deps): update dependency webpack to v5.70.0",5,62,1
"birchill/10ten-ja-reader","8d9185966dec32e1a11c882a5dc6eaf9274abf7f","renovate-bot","2022-03-31 19:03:46","true","chore(deps): update dependency @actions/github to v5.0.1",5,63,1
"birchill/10ten-ja-reader","7d422fc52ab0aac193e26258f905e8ba15a0b32e","renovate-bot","2022-06-06 17:41:59","true","chore(deps): update typescript-eslint monorepo to v5.27.1",6,65,1
"birchill/10ten-ja-reader","8ba70a921fb4b3a54baa07b75808bed3774b9ab0","birtles","2018-08-19 23:02:05","false","Watch for changes to command modifier checkboxes",14,19,0
"birchill/10ten-ja-reader","85aef6be2138aed5fee5ecafa8033d4841bf1d6b","birtles","2021-09-01 02:01:10","false","chore: Update changelog",11,56,1
"birchill/10ten-ja-reader","1a315f7585cd975fcf5e4225ebc43565a4ff1889","birtles","2019-10-17 07:22:04","false","Start tweaking top section of kanji display",12,33,0
"birchill/10ten-ja-reader","bcc391b1c768cb600b974e486c2db96f242340d4","birtles","2021-09-20 07:02:02","false","fix: Drop extra gutter for thumb when puck is pointing down",8,56,1
"birchill/10ten-ja-reader","45b9b4bb9048298e6d39faef55cc175b73148c3a","birtles","2018-10-06 08:27:44","false","Merge 漢字検定 data when updating DB",13,21,0
"birchill/10ten-ja-reader","22028049e5a2dc15a1d26e81c09e67e267de4b9a","birtles","2021-12-02 10:58:48","false","fix: show the copy status bar in touch mode if we entered copy mode using the keyboard",8,59,1
"birchill/10ten-ja-reader","3e9f8f16d4982fe8d717860b70b910590b76a726","birtles","2018-08-23 00:03:59","false","Add error reporting for failed shortcut key updates",14,19,0
"birchill/10ten-ja-reader","c698703bd80a32045f94c4473461194961aad731","birtles","2019-12-12 03:31:19","false","Log 'other error'",14,35,0
"birchill/10ten-ja-reader","c4419d172ef27f9a757d513f3aebc4c2d9885420","birtles","2019-12-12 03:54:17","false","Update changelog",14,35,0
"birchill/10ten-ja-reader","0dc95264213765ac339039cde1e143681f733e7b","birtles","2018-06-26 04:40:24","false","Update changelog",11,17,0
"birchill/10ten-ja-reader","ec43eb173de6312393ebdcfc6bd1edd567b4e09b","birtles","2017-09-04 23:28:50","false","Pass reference names along with kanji result",0,8,0
"birchill/10ten-ja-reader","cd8f4e09b222ee2811dc730802685a45fe2617da","birtles","2017-08-21 05:53:26","false","Minor tweaks to data.js",0,7,0
"birchill/10ten-ja-reader","1d9b72d426c923c6b91074abc40cb5d41184c78d","birtles","2017-08-17 23:39:29","false","Update package-lock.json, not sure why",0,7,0
"birchill/10ten-ja-reader","6782448a76349043264ea232b04b84a856a6e248","birtles","2017-10-25 12:56:58","false","Add pre-commit hook for prettier",1,9,0
"birchill/10ten-ja-reader","1b3b4fb94b2cc7dab8f4f381230fb7faa9a07a00","shirakaba","2021-07-31 13:53:30","false","feat: rename window -> stage and resize stageHeight for puck.",12,55,1
"birchill/10ten-ja-reader","608ff212efa87297507afc75b4ff0c117d6720df","birtles","2019-10-12 01:32:05","false","Export default key settings separately to config class",12,33,0
"birchill/10ten-ja-reader","a39dc97fa131b6beb9df398da5afb09ad2baf434","birtles","2021-09-22 09:43:53","false","chore: Add metadata to Mac Info.plist",8,56,1
"birchill/10ten-ja-reader","50da81cb3dd08f2e33c83ff5286cc0c902fd5719","birtles","2021-03-29 01:35:23","false","chore: Update hikibiki-data to 7.0.5",13,51,1
"birchill/10ten-ja-reader","8e07bb7a1870433230919f314b9a39c67197986d","birtles","2019-01-27 08:20:44","false","Bump version to 0.0.30",10,25,0
"birchill/10ten-ja-reader","0b646dedfb33cdb2e76c12f528db5c646fc5d3af","birtles","2018-11-08 10:31:45","false","Add support for a bunch of other irregular verbs

Sources:
http://www.asahi-net.or.jp/~QM4H-IIM/ktb019.htm
https://en.wikipedia.org/wiki/Japanese_irregular_verbs#Euphony",13,22,0
"birchill/10ten-ja-reader","3bf3f6cd06a26b13fa67db3f1dcb7f9bf7ff52e6","birtles","2019-11-25 02:12:06","false","Tidy up unused strings",13,34,0
"birchill/10ten-ja-reader","f71709a82efabb7491a34762af522e8712bd016c","birtles","2022-02-05 04:24:12","false","v1.7.0",5,61,1
"birchill/10ten-ja-reader","fe6f01d3d4a447a2b7810420e9a0154858238f94","birtles","2018-08-24 03:49:14","false","Update changelog",13,19,0
"birchill/10ten-ja-reader","d9a1b34abe20f3e48eadb192cb73d44be43ff94e","birtles","2018-08-23 22:45:56","false","Capture keys on keydown instead of keypress

Firefox Nightly no longer dispatches keypress events for non-printable
keys so if we use keypress we won't be able to catch F2 etc.",14,19,0
"birchill/10ten-ja-reader","34493492eca485df5a4848055282f2f1ac40dd43","birtles","2018-06-26 08:41:50","false","Add link to twitter",11,17,0
"birchill/10ten-ja-reader","25ef4e02931b483704f2e74f50dc6ea97e9dddbe","birtles","2017-10-17 23:00:09","false","Add basic iframe handling",0,9,0
"birchill/10ten-ja-reader","bf90551b8c7f9c0b495a3b2e25cdc31f0f54cd43","birtles","2017-09-08 00:03:58","false","Render kanji components",0,8,0
"birchill/10ten-ja-reader","b2f99111d504d74307d03bc866735d8116b18d23","birtles","2017-09-07 03:45:36","false","Finish initial implementation of client-side kanji HTML generation",0,8,0
"birchill/10ten-ja-reader","0f4ad21298a8ae2d2898f8232229ff144b58df7e","birtles","2017-09-03 12:08:05","false","Let (newer?) version of npm write package.json meaninglessly",0,8,0
"birchill/10ten-ja-reader","784ebbfcf1daa802a616a61224e86548d925de52","birtles","2018-05-31 02:10:49","false","Add deinfection rule for させる→す

As reported in #36.",13,17,0
"birchill/10ten-ja-reader","0b85422301e4170b39935c195876af15a86189f3","birtles","2022-06-02 09:08:49","false","feat: support toggling the extension in mail compose windows",6,65,1
"birchill/10ten-ja-reader","0a05c87e2a59454678e43c6af6804d4d31b0873a","birtles","2018-08-07 03:15:45","false","Update changelog",14,19,0
"birchill/10ten-ja-reader","2ca494539701ecd7c0d7798f889079d2a47ca3e8","renovate-bot","2022-02-23 09:34:28","true","chore(deps): update dependency @types/jest to v27.4.1",5,61,1
"birchill/10ten-ja-reader","84f9703768394cf02d57e51f4da05c79347d0969","renovate-bot","2022-03-07 18:38:48","true","chore(deps): update typescript-eslint monorepo to v5.14.0",7,62,1
